{
    "$schema": "http://json-schema.org/draft-07/schema#",
    "title": "Recipe",
    "type": "object",
    "properties": {
      "name": {
        "type": "string",
        "description": "The name of the recipe"
      },
      "servings": {
        "type": "integer",
        "description": "Number of servings"
      },
      "ingredients": {
        "type": "array",
        "description": "List of ingredients",
        "items": {
          "type": "object",
          "properties": {
            "ingredient": {
              "type": "string",
              "description": "Name of the ingredient. Must be in nutrient database"
            },
            "amount": {
              "type": "number",
              "description": "Amount of the ingredient"
            },
            "amount_unit": {
              "type": "string",
              "description": "Unit of the amount. Must be one of the following: GRAMS, CUP, MILLILITERS, LARGE_UNIT, MEDIUM_UNIT, SMALL_UNIT, TABLESPOON, TEASPOON"
            }
          },
          "required": ["ingredient", "amount", "amount_unit"]
        }
      },
      "prep_instructions": {
        "type": "array",
        "description": "Preparation instructions",
        "items": {
          "type": "string"
        }
      },
      "instructions": {
        "type": "array",
        "description": "Cooking instructions",
        "items": {
          "type": "string"
        }
      },
      "notes": {
        "type": "string",
        "description": "Additional notes for the recipe"
      },
      "prep_time": {
        "type": "integer",
        "description": "Preparation time in minutes"
      },
      "cooking_time": {
        "type": "integer",
        "description": "Cooking time in minutes"
      }
    },
    "required": ["name", "servings", "ingredients", "instructions", "prep_time", "cooking_time"]
  }
  