{
    "name": "Dahl",
    "servings": 4,
    "ingredients": [
      {
        "ingredient": "Red Lentils",
        "amount": 190,
        "amount_unit": "GRAMS"
      },
      {
        "ingredient": "Olive Oil",
        "amount": 2,
        "amount_unit": "TABLESPOON"
      },
      {
        "ingredient": "Onion",
        "amount": 1,
        "amount_unit": "UNIT"
      },
      {
        "ingredient": "Garlic",
        "amount": 2,
        "amount_unit": "UNIT"
      },
      {
        "ingredient": "Green Chilli Pepper",
        "amount": 1,
        "amount_unit": "UNIT"
      },
      {
        "ingredient": "Ginger",
        "amount": 1.5,
        "amount_unit": "TEASPOON"
      },
      {
        "ingredient": "Curry Powder",
        "amount": 2,
        "amount_unit": "TEASPOON"
      },
      {
        "ingredient": "Turmeric",
        "amount": 0.5,
        "amount_unit": "TEASPOON"
      },
      {
        "ingredient": "Cumin",
        "amount": 0.5,
        "amount_unit": "TEASPOON"
      },
      {
        "ingredient": "Coriander",
        "amount": 1.5,
        "amount_unit": "TEASPOON"
      },
      {
        "ingredient": "Tomato Paste",
        "amount": 2,
        "amount_unit": "TEASPOON"
      },
      {
        "ingredient": "Water",
        "amount": 350,
        "amount_unit": "MILLILITERS"
      },
      {
        "ingredient": "Coconut Milk",
        "amount": 400,
        "amount_unit": "MILLILITERS"
      },
      {
        "ingredient": "Salt",
        "amount": 2,
        "amount_unit": "TEASPOON"
      }

    ],
    "prep_instructions": [
        "Cut the onion, ginger, pepper and garlic finely",
        "Take off the cilantro leaves, wash them in water",
        "Prepare the spice mix",
        "Add hot water to the red lentils and smash to form a paste"
    ],

    "instructions": [
        "Heat some olive oil in a pan",
        "When the olive is hot, add the onions, ginger, ppeper and garlic",
        "Cook everything until slightly brown",
        "Add tomato paste and the spice mix and cook for 2 min",
        "Add the red lentil paste to the pan",
        "Add the coconut milk",
        "Add salt and black pepper", 
        "Keep cooking until the water reduces, stirring",
        "When ready, turn off the heat and add chopped cilantro to serve"
    ],
    "notes": "Serve with some tahini for nutty flavor",
    "prep_time": 10,
    "cooking_time": 45
  }